,no,s,n,marketCap,price,change,revenue,url
0,1,she/300750,"Contemporary Amperex Technology Co., Limited",1111360063931.0,262.44,3.12,365284542900.0,quote/she/300750
1,2,she/002594,BYD Company Limited,1053648264662.4122,368.9,5.1,682291828000.0,quote/she/002594
2,3,she/000333,"Midea Group Co., Ltd.",525831824937.99994,71.23,1.61,399901989000.0,quote/she/000333
3,4,she/000858,"Wuliangye Yibin Co.,Ltd.",513886083782.0,138.63,4.26,88651259789.0,quote/she/000858
4,5,she/300059,"East Money Information Co.,Ltd.",368592416791.0,24.04,1.82,9791984992.0,quote/she/300059
5,6,she/002415,"Hangzhou Hikvision Digital Technology Co., Ltd.",307280840289.0,33.15,-0.39,93055311392.0,quote/she/002415
6,7,she/300760,"Shenzhen Mindray Bio-Medical Electronics Co., Ltd.",295756992611.0,250.03,2.38,37112908413.0,quote/she/300760
7,8,she/002475,"Luxshare Precision Industry Co., Ltd.",292190641770.0,40.87,0.79,253207528461.0,quote/she/002475
8,9,she/000651,"Gree Electric Appliances, Inc. of Zhuhai",233572363264.0,43.15,2.45,195694332711.0,quote/she/000651
9,10,she/002371,"NAURA Technology Group Co., Ltd.",231165828270.0,442.19,-0.14,27843866758.0,quote/she/002371
10,11,she/000001,"Ping An Bank Co., Ltd.",229766071464.0,11.98,1.1,100943000000.0,quote/she/000001
11,12,she/002352,"S.F. Holding Co., Ltd.",215592102808.0,43.96,2.14,276258797000.0,quote/she/002352
12,13,she/002714,"Muyuan Foods Co., Ltd.",206156738390.0,38.4,1.13,124667197779.0,quote/she/002714
13,14,she/000568,"Luzhou Laojiao Co.,Ltd",199096160296.0,142.87,5.22,32594134256.0,quote/she/000568
14,15,she/300124,"Shenzhen Inovance Technology Co.,Ltd",194744530030.0,72.27,-3.25,35696143100.0,quote/she/300124
15,16,she/300999,"Yihai Kerry Arawana Holdings Co., Ltd",171864451691.0,32.27,1.26,238866319000.0,quote/she/300999
16,17,she/003816,"CGN Power Co., Ltd.",169379303888.24792,3.66,1.1,84976425162.0,quote/she/003816
17,18,she/000063,ZTE Corporation,169088089547.0,37.33,-3.74,121298752000.0,quote/she/000063
18,19,she/002142,"Bank of Ningbo Co., Ltd.",164099231181.0,25.74,5.67,54737000000.0,quote/she/002142
19,20,she/300033,"Hithink RoyalFlush Information Network Co., Ltd.",161538048000.0,311.88,1.63,4186794649.000001,quote/she/300033
20,21,she/000725,BOE Technology Group Company Limited,158975209439.0,4.36,1.16,191759899592.0,quote/she/000725
21,22,she/300274,"Sungrow Power Supply Co., Ltd.",139063565852.0,68.57,1.54,75782008619.0,quote/she/300274
22,23,she/000338,"Weichai Power Co., Ltd.",135230776712.06804,16.0,-2.2,215528990664.0,quote/she/000338
23,24,she/300433,"Lens Technology Co., Ltd.",127362258525.0,26.27,-6.41,66910613029.0,quote/she/300433
24,25,she/300015,"Aier Eye Hospital Group Co., Ltd.",126162184331.0,13.9,0.51,20621484187.0,quote/she/300015
25,26,she/000166,"Shenwan Hongyuan Group Co., Ltd.",119132179324.0,5.14,1.58,22458795716.0,quote/she/000166
26,27,she/002230,"iFLYTEK CO.,LTD",115805500312.0,50.81,-1.91,21886120865.0,quote/she/002230
27,28,she/002304,"Jiangsu Yanghe Distillery Co., Ltd.",115499143824.0,78.26,1.85,30359665188.0,quote/she/002304
28,29,she/300308,"Zhongji Innolight Co., Ltd.",113220756705.0,104.1,1.7,23861489011.0,quote/she/300308
29,30,she/000625,Chongqing Changan Automobile Company Limited,112977173290.0,13.06,-0.68,154050983505.0,quote/she/000625
30,31,she/300442,Range Intelligent Computing Technology Group Company Limited,110863418196.0,65.38,-1.83,8080225232.0,quote/she/300442
31,32,she/300498,"Wens Foodstuff Group Co., Ltd.",110654768010.0,16.68,0.54,104906201800.0,quote/she/300498
32,33,she/002050,"Zhejiang Sanhua Intelligent Controls Co.,Ltd",109582065527.0,30.15,-0.66,26144921008.0,quote/she/002050
33,34,she/000425,"XCMG Construction Machinery Co., Ltd.",108566696800.0,9.17,-2.34,89903979386.0,quote/she/000425
34,35,she/000776,"GF Securities Co., Ltd.",107342208638.0,15.63,1.3,23370748053.0,quote/she/000776
35,36,she/300014,"EVE Energy Co., Ltd.",100405575811.0,49.37,-2.22,47304026620.0,quote/she/300014
36,37,she/002736,"Guosen Securities Co., Ltd.",99873141227.0,10.54,0.38,17144477031.999998,quote/she/002736
37,38,she/002027,"Focus Media Information Technology Co., Ltd.",99506756112.0,7.02,2.93,12489930414.0,quote/she/002027
38,39,she/000538,"Yunnan Baiyao Group Co.,Ltd",97848961149.0,55.37,0.91,39337915150.0,quote/she/000538
39,40,she/002241,Goertek Inc.,91583489269.0,27.06,-2.98,94271940831.0,quote/she/002241
40,41,she/000895,"Henan Shuanghui Investment & Development Co.,Ltd.",91363116187.0,26.42,-0.34,57864495397.0,quote/she/000895
41,42,she/002179,"Jonhon Optronic Technology Co., Ltd.",89850781534.0,42.38,0.24,20690003747.0,quote/she/002179
42,43,she/000596,"Anhui Gujing Distillery Co., Ltd.",89636566950.0,191.5,2.08,23369465104.0,quote/she/000596
43,44,she/000792,"Qinghai Salt Lake Industry Co.,Ltd",88422177160.0,17.03,3.34,16237100865.0,quote/she/000792
44,45,she/001965,"China Merchants Expressway Network & Technology Holdings Co.,Ltd.",88255165878.0,12.95,0.86,12232820273.0,quote/she/001965
45,46,she/002625,"Kuang-Chi Technologies Co., Ltd.",88059887227.0,41.05,-1.39,1539292573.0,quote/she/002625
46,47,she/002938,"Avary Holding(Shenzhen)Co., Limited",86383091168.0,38.25,-0.08,35140384500.0,quote/she/002938
47,48,she/000100,TCL Technology Group Corporation,86011432852.0,4.72,1.29,164411943426.0,quote/she/000100
48,49,she/001979,"China Merchants Shekou Industrial Zone Holdings Co., Ltd.",85443685149.0,9.53,1.06,178947546600.0,quote/she/001979
49,50,she/000977,"Inspur Electronic Information Industry Co., Ltd.",85074688700.0,58.32,-1.97,100736320172.0,quote/she/000977
50,51,she/002493,"Rongsheng Petrochemical Co., Ltd.",83278941635.0,8.67,-0.46,331260614874.0,quote/she/002493
51,52,she/000002,"China Vanke Co., Ltd.",83071418623.0,7.48,0.54,395325413701.0,quote/she/000002
52,53,she/002311,"Guangdong Haid Group Co., Limited",82901436485.0,50.38,-0.24,114684932200.0,quote/she/002311
53,54,she/000938,Unisplendour Corporation Limited,81483675610.0,28.84,-2.67,80932389527.0,quote/she/000938
54,55,she/000617,CNPC Capital Company Limited,80656464524.0,6.5,1.4,39993109758.0,quote/she/000617
55,56,she/300979,Huali Industrial Group Company Limited,77278740000.0,65.45,1.3,24006169500.0,quote/she/300979
56,57,she/300408,"Chaozhou Three-Circle (Group) Co.,Ltd.",73785148784.0,38.94,0.88,7380412228.0,quote/she/300408
57,58,she/002648,"Satellite Chemical Co.,Ltd.",71239480290.0,21.31,-2.56,47426054500.0,quote/she/002648
58,59,she/000768,AVIC Xi'an Aircraft Industry Group Company Ltd.,70962189211.0,25.42,-0.94,40709090129.0,quote/she/000768
59,60,she/300251,"Beijing Enlight Media Co., Ltd.",67660313500.00001,23.71,0.38,2047341256.0,quote/she/300251
60,61,she/002600,Lingyi iTech (Guangdong) Company,67269298009.00001,9.66,-4.36,40962143495.0,quote/she/002600
61,62,she/000157,"Zoomlion Heavy Industry Science and Technology Co., Ltd.",66831334086.0,8.09,-1.58,45946460089.0,quote/she/000157
62,63,she/002920,"Huizhou Desay SV Automotive Co., Ltd.",66650628023.0,122.68,-1.11,26412376295.0,quote/she/002920
63,64,she/002463,"Wus Printed Circuit (Kunshan) Co., Ltd.",66575396404.0,35.72,0.96,13341541440.0,quote/she/002463
64,65,she/002460,"Ganfeng Lithium Group Co., Ltd.",66108757777.00001,36.52,0.88,21214911336.0,quote/she/002460
65,66,she/002916,Shennan Circuit Company Limited,65648324479.99999,133.6,5.14,17907445251.0,quote/she/002916
66,67,she/002001,Zhejiang NHU Company Ltd.,65617552868.0,21.45,-2.14,19886094044.0,quote/she/002001
67,68,she/300502,"Eoptolink Technology Inc., Ltd.",65585879510.0,94.2,0.36,6140994006.0,quote/she/300502
68,69,she/000807,"Yunnan Aluminium Co., Ltd.",64018493696.0,18.25,0.11,52093513193.0,quote/she/000807
69,70,she/301236,"iSoftStone Information Technology (Group) Co., Ltd.",63056117682.0,66.84,1.27,26957038927.0,quote/she/301236
70,71,she/002236,"Zhejiang Dahua Technology Co., Ltd.",62940981397.0,19.26,2.39,32389915469.0,quote/she/002236
71,72,she/000708,"Citic Pacific Special Steel Group Co., Ltd",61625787397.0,12.13,-0.74,111108881975.0,quote/she/000708
72,73,she/300476,"Victory Giant Technology (HuiZhou)Co.,Ltd.",61235836231.0,79.04,13.17,10731469489.0,quote/she/300476
73,74,she/000963,"Huadong Medicine Co., Ltd",61025176203.0,35.56,2.39,41706906760.0,quote/she/000963
74,75,she/000301,"Jiangsu Eastern Shenghong Co.,Ltd.",61021586056.0,9.15,-1.61,145064391935.0,quote/she/000301
75,76,she/300896,"Imeik Technology Development Co.,Ltd.",60354565423.0,202.99,5.18,3074607505.0,quote/she/300896
76,77,she/301269,"Empyrean Technology Co., Ltd.",59739882733.0,110.029999,-0.87,1114352094.0,quote/she/301269
77,78,she/300122,"Chongqing Zhifei Biological Products Co., Ltd.",59126606751.0,24.96,-0.24,36432356925.0,quote/she/300122
78,79,she/000408,Zangge Mining Company Limited,58679374674.0,36.85,-1.23,3360169275.0,quote/she/000408
79,80,she/002049,"Unigroup Guoxin Microelectronics Co., Ltd.",58435621052.0,69.53,-1.65,5511050000.0,quote/she/002049
80,81,she/002028,"Sieyuan Electric Co., Ltd.",56592030086.0,73.09,-0.41,15458349735.0,quote/she/002028
81,82,she/002384,"Suzhou Dongshan Precision Manufacturing Co., Ltd.",54144590685.0,32.51,1.5,37616847486.0,quote/she/002384
82,83,she/300866,Anker Innovations Limited,53406782988.0,100.91,1.05,22169392153.0,quote/she/300866
83,84,she/000999,"China Resources Sanjiu Medical & Pharmaceutical Co., Ltd.",52707618032.0,41.75,1.33,27616611772.0,quote/she/000999
84,85,she/000564,"Ccoop Group Co., Ltd",51826641826.0,2.92,-1.35,1490444503.0,quote/she/000564
85,86,she/300765,"CSPC Innovation Pharmaceutical Co., Ltd.",51651263948.0,37.02,-0.05,2043417253.0,quote/she/300765
86,87,she/002466,Tianqi Lithium Corporation,51203012317.0,32.42,-0.22,17169034358.0,quote/she/002466
87,88,she/002602,"Zhejiang Century Huatong Group Co.,Ltd",51037751365.0,7.06,2.92,19026060951.0,quote/she/002602
88,89,she/300413,"Mango Excellent Media Co., Ltd.",50977142209.0,27.67,-0.5,14540106253.0,quote/she/300413
89,90,she/000786,Beijing New Building Materials Public Limited Company,50685235260.0,29.79,-0.2,25740324807.0,quote/she/000786
90,91,she/300628,"Yealink Network Technology Co., Ltd.",50624671664.0,40.41,0.27,5618363700.0,quote/she/300628
91,92,she/300394,"Suzhou TFC Optical Communication Co., Ltd.",50356069435.0,95.21,4.51,3127194321.0,quote/she/300394
92,93,she/000066,"China Greatwall Technology Group Co., Ltd.",50019010675.0,15.58,-2.99,14972344305.0,quote/she/000066
93,94,she/002422,"Sichuan Kelun Pharmaceutical Co., Ltd.",49986752221.0,31.45,1.78,22499607194.0,quote/she/002422
94,95,she/000975,"Shanjin International Gold Co., Ltd.",48203898520.0,18.1,5.72,13081974954.0,quote/she/000975
95,96,she/300454,Sangfor Technologies Inc.,48049661606.0,113.92,-1.77,7487543719.0,quote/she/300454
96,97,she/002456,"OFILM Group Co., Ltd.",47317159319.0,13.84,-3.15,20515256773.0,quote/she/002456
97,98,she/002252,"Shanghai RAAS Blood Products Co., Ltd.",46694768298.0,7.05,0.86,8343000865.0,quote/she/002252
98,99,she/300832,"Shenzhen New Industries Biomedical Engineering Co., Ltd.",46318122376.0,59.18,-1.1,4435826914.0,quote/she/300832
99,100,she/300418,"Kunlun Tech Co., Ltd.",46094859871.0,37.76,-0.81,5062458961.0,quote/she/300418
100,101,she/300339,"Jiangsu Hoperun Software Co., Ltd.",45960953849.0,60.02,4.69,3353283160.0,quote/she/300339
101,102,she/300474,"Changsha Jingjia Microelectronics Co., Ltd.",45692598667.0,88.03,-1.2,713248175.0,quote/she/300474
102,103,she/000933,Henan Shenhuo Coal Industry and Electricity Power Co. Ltd,45414387988.0,19.98,-1.48,37309636278.0,quote/she/000933
103,104,she/001872,"China Merchants Port Group Co., Ltd.",45401790654.0,18.65,0.11,16161509348.0,quote/she/001872
104,105,she/300782,Maxscend Microelectronics Company Limited,45356358090.0,85.42,-1.08,4671868988.0,quote/she/300782
105,106,she/300347,"Hangzhou Tigermed Consulting Co., Ltd",44892725172.0,57.96,2.38,6801176881.0,quote/she/300347
106,107,she/300661,SG Micro Corp,44507771995.0,94.13,-2.86,3179377603.0,quote/she/300661
107,108,she/000630,"Tongling Nonferrous Metals Group Co.,Ltd.",44135575383.0,3.52,2.03,141167085605.0,quote/she/000630
108,109,she/002601,"LB Group Co., Ltd.",43808202386.0,18.59,-0.43,27369592822.0,quote/she/002601
109,110,she/002261,"Talkweb Information System Co.,Ltd.",43635298694.0,34.24,-2.64,4226414356.999999,quote/she/002261
110,111,she/300316,"Zhejiang Jingsheng Mechanical & Electrical Co., Ltd.",43588013549.0,33.9,-1.45,18999273244.0,quote/she/300316
111,112,she/002532,"Tianshan Aluminum Group Co.,Ltd",43556419075.0,9.34,-0.21,27426854783.0,quote/she/002532
112,113,she/301165,"Ruijie Networks Co., Ltd.",43471590895.0,77.7,-2.88,11967539768.0,quote/she/301165
113,114,she/000876,"New Hope Liuhe Co.,Ltd.",43398533485.0,9.68,-1.43,112164606125.0,quote/she/000876
114,115,she/002128,Inner Mongolia Dian Tou Energy Corporation Limited,43352031355.0,19.22,1.75,28924734613.0,quote/she/002128
115,116,she/000988,Huagong Tech Company Limited,43266781482.0,44.38,-2.91,11916552756.0,quote/she/000988
116,117,she/000158,"Shijiazhuang ChangShan BeiMing Technology Co.,Ltd",43130679133.0,26.48,4.17,9267519368.0,quote/she/000158
117,118,she/300759,"Pharmaron Beijing Co., Ltd.",43020869726.0,27.33,1.94,11795014455.0,quote/she/300759
118,119,she/301308,"Shenzhen Longsys Electronics Co., Ltd.",42521635472.0,104.36,2.09,16814419580.000002,quote/she/301308
119,120,she/002032,"Zhejiang Supor Co., Ltd.",42264522961.0,53.24,0.36,22427337986.0,quote/she/002032
120,121,she/300207,"Sunwoda Electronic Co.,Ltd",42219921224.0,23.4,0.26,51822168281.0,quote/she/300207
121,122,she/002156,"Tongfu Microelectronics Co.,Ltd",42174018184.0,28.09,-1.92,23443873316.0,quote/she/002156
122,123,she/002945,"ChinaLin Securities Co., Ltd",41553000000.0,15.68,0.13,1229974717.0,quote/she/002945
123,124,she/002595,"Himile Mechanical Science and Technology (Shandong) Co., Ltd",41205634080.0,52.04,-0.38,8229033998.000001,quote/she/002595
124,125,she/002064,"Huafon Chemical Co.,Ltd",41139488906.0,8.24,-1.32,26989117412.0,quote/she/002064
125,126,she/002074,"Gotion High-tech Co.,Ltd.",40828056347.0,23.11,-0.09,35001848531.0,quote/she/002074
126,127,she/002085,"Zhejiang Wanfeng Auto Wheel Co., Ltd.",40554982632.0,19.19,-3.62,15978352041.0,quote/she/002085
127,128,she/002078,"Shandong Sunpaper Co., Ltd.",40185415011.0,14.43,1.33,40739143655.0,quote/she/002078
128,129,she/002459,"JA Solar Technology Co., Ltd.",39983688354.0,12.51,0.48,75922924078.0,quote/she/002459
129,130,she/000983,"Shanxi Coking Coal Energy Group Co., Ltd.",39966791455.0,6.99,2.34,47919272374.0,quote/she/000983
130,131,she/000661,"Changchun High-Tech Industry (Group) Co., Ltd.",39465748792.0,98.67,0.85,14272271541.0,quote/she/000661
131,132,she/002281,"Accelink Technologies Co,Ltd.",39274900347.0,50.18,-2.73,7111896472.0,quote/she/002281
132,133,she/301498,"Gambol Pet Group Co., Ltd.",39268368120.0,98.5,0.77,4886088612.0,quote/she/301498
133,134,she/000800,"FAW Jiefang Group Co.,Ltd",39132850849.0,8.0,-0.5,60916922977.0,quote/she/000800
134,135,she/000877,"Tianshan Material Co., Ltd.",38965494483.0,5.52,1.28,88452407183.0,quote/she/000877
135,136,she/002180,Ninestar Corporation,38308055545.0,27.36,-2.04,25510017271.0,quote/she/002180
136,137,she/002065,"DHC Software Co.,Ltd.",38145240263.0,11.95,-5.83,12276670526.0,quote/she/002065
137,138,she/002709,"Guangzhou Tinci Materials Technology Co., Ltd.",38017412161.0,20.11,-1.71,12143346133.0,quote/she/002709
138,139,she/002653,"Haisco Pharmaceutical Group Co., Ltd.",37969955766.0,34.31,-1.52,3722371795.0,quote/she/002653
139,140,she/000423,"Dong-E-E-Jiao Co.,Ltd.",37706237045.0,58.97,1.94,5616212426.0,quote/she/000423
140,141,she/002851,"Shenzhen Megmeet Electrical Co., LTD",37163232870.0,69.33,3.63,7781166869.0,quote/she/002851
141,142,she/300223,"Ingenic Semiconductor Co.,Ltd.",37153118634.0,78.05,-4.72,4312242019.0,quote/she/300223
142,143,she/000921,"Hisense Home Appliances Group Co., Ltd.",37094919132.0,29.27,3.94,91279644308.0,quote/she/000921
143,144,she/002414,"Wuhan Guide Infrared Co., Ltd.",37069989417.0,8.59,-1.26,2614648082.0,quote/she/002414
144,145,she/002223,"Jiangsu Yuyue Medical Equipment & Supply Co., Ltd.",36813626482.0,36.68,-1.37,7336609891.0,quote/she/002223
145,146,she/300450,"Wuxi Lead Intelligent Equipment CO.,LTD.",36664295282.0,23.48,-2.04,12553942278.0,quote/she/300450
146,147,she/300383,"Beijing Sinnet Technology Co.,Ltd",36491134794.0,20.09,-4.92,7748199575.0,quote/she/300383
147,148,she/000932,"Hunan Valin Steel Co., Ltd.",36477579595.0,5.24,2.95,155860041986.0,quote/she/000932
148,149,she/302132,AVIC Chengdu Aircraft Company Limited,36424219363.0,62.15,-1.69,1639946157.0,quote/she/302132
149,150,she/002353,"Yantai Jereh Oilfield Services Group Co., Ltd.",36266494607.0,36.46,2.42,13202874370.0,quote/she/002353
150,151,she/002673,"Western Securities Co.,Ltd.",36203611811.0,8.22,0.86,5595138989.0,quote/she/002673
151,152,she/002517,"Kingnet Network Co., Ltd.",36088164861.0,17.2,1.53,5193504481.0,quote/she/002517
152,153,she/002195,"Shanghai Stonehill Technology Co., Ltd.",35850546401.0,6.31,-6.79,617402234.0,quote/she/002195
153,154,she/000783,Changjiang Securities Company Limited,35779571974.0,6.58,1.23,6501133588.0,quote/she/000783
154,155,she/002129,"TCL Zhonghuan Renewable Energy Technology Co.,Ltd.",35737219683.0,9.01,-0.22,33074679865.0,quote/she/002129
155,156,she/300803,"Beijing Compass Technology Development Co., Ltd.",35686752352.0,90.37,1.54,1540013521.0,quote/she/300803
156,157,she/002152,"GRG Banking Equipment Co., Ltd.",35388206297.0,14.25,-2.26,10858012400.0,quote/she/002152
157,158,she/002837,"Shenzhen Envicool Technology Co., Ltd.",35386590771.0,48.23,2.38,4328717564.0,quote/she/002837
158,159,she/300115,"Shenzhen Everwin Precision Technology Co., Ltd.",35262209600.0,26.55,-2.39,16917496372.000002,quote/she/300115
159,160,she/300919,"CNGR Advanced Material Co.,Ltd.",35190068783.0,38.37,-0.31,38245540845.0,quote/she/300919
160,161,she/002340,"GEM Co., Ltd.",35171053688.0,6.96,1.02,35172809848.0,quote/she/002340
161,162,she/000728,Guoyuan Securities Company Limited,34866585349.0,8.16,1.62,7838551000.0,quote/she/000728
162,163,she/003021,"Shenzhen Zhaowei Machinery & Electronics Co., Ltd.",34740632205.0,144.6,-7.4,1449930981.0,quote/she/003021
163,164,she/002555,"37 Interactive Entertainment Network Technology Group Co., Ltd.",34644389522.0,15.9,1.27,17843274241.0,quote/she/002555
164,165,she/002185,"Tianshui Huatian Technology Co., Ltd.",34640479045.0,10.91,-1.27,13761049242.0,quote/she/002185
165,166,she/000039,"China International Marine Containers (Group) Co., Ltd.",34527366750.0,8.58,3.37,161656095000.0,quote/she/000039
166,167,she/000831,"China Rare Earth Resources And Technology Co., Ltd.",34500288436.0,32.58,0.4,2388886904.0,quote/she/000831
167,168,she/002202,"Goldwind Science&Technology Co., Ltd.",34491961813.0,9.17,1.21,56977155609.0,quote/she/002202
168,169,she/001286,"Shaanxi Energy Investment Co., Ltd.",34200000000.0,9.08,0.11,22093242495.0,quote/she/001286
169,170,she/002850,"Shenzhen Kedali Industry Co., Ltd.",34153597155.000004,127.89,-0.51,11335178713.0,quote/she/002850
170,171,she/002294,"Shenzhen Salubris Pharmaceuticals Co., Ltd.",33700903853.000004,30.9,2.9,3910103147.0,quote/she/002294
171,172,she/002444,"Hangzhou Greatstar Industrial Co., Ltd",33624560823.0,28.42,-1.08,13403512438.0,quote/she/002444
172,173,she/000729,"Beijing Yanjing Brewery Co.,Ltd.",33512432763.999996,12.14,2.27,14643296095.0,quote/she/000729
173,174,she/002939,"China Great Wall Securities Co.,Ltd.",33485743734.999996,8.65,3.35,3674354363.0,quote/she/002939
174,175,she/002244,"Hangzhou Binjiang Real Estate Group Co.,Ltd",33136877429.0,10.63,-2.03,64833606158.0,quote/she/002244
175,176,she/002273,"Zhejiang Crystal-Optech Co., Ltd",32759843121.0,23.82,-5.18,6236508632.0,quote/she/002273
176,177,she/002797,"First Capital Securities Co., Ltd.",32694672000.0,7.94,1.15,2965632737.0,quote/she/002797
177,178,she/002271,"Beijing Oriental Yuhong Waterproof Technology Co., Ltd.",32295222188.0,13.56,-1.02,28055609124.0,quote/she/002271
178,179,she/000987,"Guangzhou Yuexiu Capital Holdings Group Co., Ltd.",32059476432.0,6.56,1.55,10463954971.0,quote/she/000987
179,180,she/002812,"Yunnan Energy New Material Co., Ltd.",32025544172.0,33.4,2.45,10413497755.0,quote/she/002812
180,181,she/300017,"Wangsu Science & Technology Co.,Ltd.",31893100458.0,13.27,-3.0,4798213167.0,quote/she/300017
181,182,she/000034,"Digital China Group Co., Ltd.",31647553268.0,47.61,-2.24,127040013306.0,quote/she/000034
182,183,she/300857,"Sharetronic Data Technology Co., Ltd.",31385301034.0,125.9,-2.21,6824192352.0,quote/she/300857
183,184,she/000733,"China Zhenhua (Group) Science & Technology Co., Ltd",31327197934.0,55.07,3.32,5499906734.0,quote/she/000733
184,185,she/002966,"Bank of Suzhou Co., Ltd.",31319114857.0,7.89,1.81,10766986446.0,quote/she/002966
185,186,she/300024,"Siasun Robot&Automation Co.,Ltd.",30999275010.0,19.85,-3.55,3984713989.0,quote/she/300024
186,187,she/000883,"Hubei Energy Group Co., Ltd.",30944357418.0,4.75,1.06,19640293741.0,quote/she/000883
187,188,she/000958,"SPIC Industry-Finance Holdings Co., Ltd.",30900822305.0,5.8,-1.69,5746848858.0,quote/she/000958
188,189,she/000021,"Shenzhen Kaifa Technology Co., Ltd.",30696757856.0,19.97,-1.24,14144931451.0,quote/she/000021
189,190,she/002465,Guangzhou Haige Communications Group Incorporated Company,30402465863.0,12.18,-0.98,6180399356.0,quote/she/002465
190,191,she/000027,"Shenzhen Energy Group Co., Ltd.",30114278168.0,6.31,0.48,41564728897.0,quote/she/000027
191,192,she/301536,SigmaStar Technology Ltd.,30046841600.0,71.92,-2.94,2358849647.0,quote/she/301536
192,193,she/002568,"Shanghai Bairun Investment Holding Group Co., Ltd.",30022329226.0,28.73,3.09,3193169719.0,quote/she/002568
193,194,she/002472,"Zhejiang Shuanghuan Driveline Co.,Ltd.",29975697469.0,36.14,-5.27,8944773178.0,quote/she/002472
194,195,she/301358,"Hunan Yuneng New Energy Battery Material Co.,Ltd.",29828198427.0,39.9,-2.61,22908558544.0,quote/she/301358
195,196,she/002008,"Han's Laser Technology Industry Group Co., Ltd.",29241498937.0,28.41,-1.49,14832684210.0,quote/she/002008
196,197,she/002558,"Giant Network Group Co., Ltd.",29209170710.0,15.92,1.08,2875330466.0,quote/she/002558
197,198,she/002423,"COFCO Capital Holdings Co., Ltd.",29193017635.0,12.99,1.09,30425061859.0,quote/she/002423
198,199,she/002007,Hualan Biological Engineering Inc.,29095904533.0,15.99,0.31,4919550054.0,quote/she/002007
199,200,she/002409,"Jiangsu Yoke Technology Co., Ltd.",28850735840.0,61.34,-0.74,6195152578.0,quote/she/002409
200,201,she/000032,"Shenzhen SED Industry Co., Ltd.",28790368620.0,25.48,-3.7,66034045870.99999,quote/she/000032
201,202,she/300458,"Allwinner Technology Co.,Ltd.",28771307860.0,57.51,-5.43,2287908816.0,quote/she/300458
202,203,she/000887,"Anhui Zhongding Sealing Parts Co., Ltd.",28765300972.0,22.0,3.43,18965591236.0,quote/she/000887
203,204,she/002155,Hunan Gold Corporation Limited,28548437508.0,24.11,0.5,25539459391.0,quote/she/002155
204,205,she/300496,"Thunder Software Technology Co.,Ltd.",28442543135.0,62.53,-1.29,5060120967.0,quote/she/300496
205,206,she/002130,"ShenZhen Woer Heat-Shrinkable Material Co.,Ltd.",28304235193.0,22.85,0.22,6931425857.0,quote/she/002130
206,207,she/002608,Jiangsu Guoxin Corp. Ltd.,28297816983.0,7.44,0.54,36932620900.0,quote/she/002608
207,208,she/301301,"Yili Chuanning Biotechnology Co.,Ltd.",28284932000.0,12.83,1.02,5698267205.0,quote/she/301301
208,209,she/002841,Guangzhou Shiyuan Electronic Technology Company Limited,27993785440.0,40.55,-1.48,22456842200.0,quote/she/002841
209,210,she/300757,"RoboTechnik Intelligent Technology Co., LTD",27919309309.0,184.6,-0.49,1507445349.0,quote/she/300757
210,211,she/000513,Livzon Pharmaceutical Group Inc.,27888154137.0,34.78,0.99,11856849545.0,quote/she/000513
211,212,she/000629,"Pangang Group Vanadium & Titanium Resources Co., Ltd.",27884910135.0,3.02,0.67,13697447198.0,quote/she/000629
212,213,she/000785,Easyhome New Retail Group Corporation Limited,27834908199.0,4.65,0.22,13247421850.0,quote/she/000785
213,214,she/300623,"Jiangsu JieJie Microelectronics Co., Ltd.",27799790094.0,32.98,-1.29,2685911582.0,quote/she/300623
214,215,she/002025,"Guizhou Space Appliance Co., LTD",27754868052.0,58.37,-3.44,5001654402.0,quote/she/002025
215,216,she/000959,"Beijing Shougang Co., Ltd.",27753112241.0,3.52,0.57,110711281493.0,quote/she/000959
216,217,she/300718,"Zhejiang Changsheng Sliding Bearings Co., Ltd.",27570380711.0,92.71,-7.02,1121415240.0,quote/she/300718
217,218,she/300604,"Hangzhou Changchuan Technology Co.,Ltd",27534599243.0,46.86,4.37,3101488966.0,quote/she/300604
218,219,she/300002,"Beijing Ultrapower Software Co., Ltd.",27471194762.0,14.16,-1.73,6451926200.0,quote/she/300002
219,220,she/300699,"Weihai Guangwei Composites Co., Ltd.",27464250000.0,32.88,-2.4,2449934900.0,quote/she/300699
220,221,she/000997,"Newland Digital Technology Co.,Ltd.",27444822517.0,27.43,1.82,7939623199.0,quote/she/000997
221,222,she/000738,"Aecc Aero-Engine Control Co.,Ltd.",27421586421.0,20.74,0.34,5433483403.0,quote/she/000738
222,223,she/000878,"Yunnan Copper Co.,Ltd",27309453865.0,13.79,1.25,165485227227.0,quote/she/000878
223,224,she/002335,"Kehua Data Co., Ltd.",27103535086.0,57.45,-0.81,8032489855.0,quote/she/002335
224,225,she/300748,"JL Mag Rare-Earth Co., Ltd.",27010231992.0,21.06,-3.57,6651551233.0,quote/she/300748
225,226,she/300373,"Yangzhou Yangjie Electronic Technology Co., Ltd.",26974943486.0,49.88,2.8,5792782360.0,quote/she/300373
226,227,she/002131,"Leo Group Co., Ltd.",26557550558.0,4.11,-4.42,20640884912.0,quote/she/002131
227,228,she/001696,"Chongqing Zongshen Power Machinery Co.,Ltd",26438671583.0,23.17,-2.85,9678978268.0,quote/she/001696
228,229,she/300779,"Qingdao Huicheng Environmental Technology Group Co., Ltd.",26413898752.0,135.14,1.04,1149511065.0,quote/she/300779
229,230,she/002821,"Asymchem Laboratories (Tianjin) Co., Ltd.",26383600096.0,78.5,1.41,5571376297.0,quote/she/002821
