,no,s,n,marketCap,price,change,revenue,url
0,1,hnx/KSV,Vinacomin - Minerals Holding Corporation,38400000000000.0,209200.0,-0.946969696969697,13250634406791.0,quote/hnx/KSV
1,2,hnx/IDC,IDICO Corporation - JSC,18149996095000.0,56600.0,0.0,8847750623476.0,quote/hnx/IDC
2,3,hnx/KSF,Real Tech Group JSC,18030000000000.0,49800.0,9.933774834437086,2327147053692.0,quote/hnx/KSF
3,4,hnx/MBS,MB Securities JSC,17527157964000.002,31100.0,0.3225806451612903,2582720688821.0,quote/hnx/MBS
4,5,hnx/PVS,PetroVietnam Technical Services Corporation,15868480828000.0,33200.0,-1.7751479289940828,23878029780802.0,quote/hnx/PVS
5,6,hnx/PVI,PVI Holdings,15600508342200.0,66600.0,-0.14992503748125938,8847086400475.0,quote/hnx/PVI
6,7,hnx/HUT,Tasco JSC,14637196226000.0,16400.0,-0.6060606060606061,30648032502235.0,quote/hnx/HUT
7,8,hnx/THD,Thaiholdings JSC,14167998969600.0,36100.0,-0.5509641873278237,973630725931.0,quote/hnx/THD
8,9,hnx/NVB,National Citizen Commercial Joint Stock Bank,13155886811200.0,11500.0,-0.8620689655172413,-1736042000000.0,quote/hnx/NVB
9,10,hnx/SHS,SaiGon - Hanoi Securities JSC,11953404195600.0,14500.0,0.6944444444444444,1931718103488.0,quote/hnx/SHS
10,11,hnx/BAB,Bac A Commercial Joint Stock Bank,11496262116000.0,12000.0,0.0,3509550000000.0,quote/hnx/BAB
11,12,hnx/VCS,Vicostone JSC,9488000000000.0,59900.0,2.218430034129693,4322071392821.0,quote/hnx/VCS
12,13,hnx/NTP,Tien Phong Plastic JSC,9449890429200.0,68900.0,-1.5714285714285716,5656563814495.0,quote/hnx/NTP
13,14,hnx/DTK,Vinacomin - Power Holding Corporation,8807700427500.0,12900.0,0.0,12839645638671.0,quote/hnx/DTK
14,15,hnx/CEO,C.E.O Group JSC,7943974550400.0,15000.0,0.6711409395973155,1307837430269.0,quote/hnx/CEO
15,16,hnx/DHT,Ha Tay Pharmaceutical JSC,7262410932000.0,88200.0,0.2272727272727273,2086352824613.0,quote/hnx/DHT
16,17,hnx/VIF,Viet Nam Forestry Corporation - Joint Stock company,6475000000000.0,17800.0,-6.315789473684211,1600198920305.0,quote/hnx/VIF
17,18,hnx/SCG,SCG Construction Group JSC,5695000000000.0,67000.0,0.0,2705064519164.0,quote/hnx/SCG
18,19,hnx/VNR,Vietnam National Reinsurance Corporation,4559786375000.0,25000.0,2.0408163265306123,2333217248720.0,quote/hnx/VNR
19,20,hnx/HGM,Ha Giang Mineral Mechanics JSC,3893400000000.0,309000.0,-1.9047619047619049,370448864861.0,quote/hnx/HGM
20,21,hnx/CDN,Danang Port JSC,3623400000000.0,36500.0,0.8287292817679558,1452619154002.0,quote/hnx/CDN
21,22,hnx/VC3,Nam Mekong Group JSC,3404105540800.0,27200.0,-0.3663003663003663,611367733216.0,quote/hnx/VC3
22,23,hnx/IPA,Ipa Investments Group JSC,3036468005000.0,14200.0,-0.6993006993006993,560054620730.0,quote/hnx/IPA
23,24,hnx/PTI,Post & Telecommunication Joint Stock Insurance Corporation,2894211096000.0,24000.0,1.694915254237288,4073958673178.0,quote/hnx/PTI
24,25,hnx/BVS,Bao Viet Securities JSC,2873565771000.0,40200.0,-0.9852216748768472,852266481158.0,quote/hnx/BVS
25,26,hnx/TNG,TNG Investment and Trading JSC,2783047376200.0,22700.0,-0.8733624454148471,7736065477143.0,quote/hnx/TNG
26,27,hnx/DNP,DongNai Plastic Construction Joint-stock Company,2734741098400.0,19700.0,0.0,8898445300977.0,quote/hnx/DNP
27,28,hnx/MVB,Vinacomin - VietBac Mining Industry Holding Corporation,2404500000000.0,24000.0,8.108108108108109,,quote/hnx/MVB
28,29,hnx/LAS,Lam Thao Fertilizers & Chemicals JSC,2189414160000.0,19500.0,-0.5102040816326531,3465765583539.0,quote/hnx/LAS
29,30,hnx/TIG,Thang Long Investment Group JSC,2187750116500.0,11600.0,0.8695652173913043,1499327044762.0,quote/hnx/TIG
30,31,hnx/PRE,Hanoi Reinsurance JSC,2119320000000.0,20000.0,0.0,1599319090739.0,quote/hnx/PRE
31,32,hnx/PLC,Petrolimex Petrochemical Corporation JSC,2036098663200.0,26500.0,3.11284046692607,6931744246143.0,quote/hnx/PLC
32,33,hnx/SLS,Son La Sugar JSC,2030849393000.0,207400.0,-0.2884615384615385,1293238824269.0,quote/hnx/SLS
33,34,hnx/VFS,Viet First Securities Corporation,1944000000000.0,16300.0,2.515723270440252,233713231787.0,quote/hnx/VFS
34,35,hnx/NET,Net Detergent JSC,1796349594800.0,80200.0,-1.3530135301353017,1652661909097.0,quote/hnx/NET
35,36,hnx/PGS,Southern Gas Trading JSC,1729958272400.0,34600.0,0.0,6438682469797.0,quote/hnx/PGS
36,37,hnx/VGS,Vietnam Germany Steel Pipe JSC,1700336630400.0,31200.0,-0.9523809523809524,7321865829546.0,quote/hnx/VGS
37,38,hnx/L18,Construction and Investment Stock Company No 18,1623764092800.0,45000.0,-1.098901098901099,4924717468479.0,quote/hnx/L18
38,39,hnx/SEB,Mien Trung Power Investment and Development JSC,1577598471700.0,49300.0,0.0,255792104003.0,quote/hnx/SEB
39,40,hnx/OCH,One Capital Hospitality JSC,1500000000000.0,7500.0,0.0,983145588033.0,quote/hnx/OCH
40,41,hnx/BCF,Bich Chi Food Company,1376226847800.0,41700.0,2.70935960591133,761888236324.0,quote/hnx/BCF
41,42,hnx/DP3,Central Pharmaceutical Joint Stock Company No3,1332995846000.0,62600.0,-0.1594896331738437,417485438238.0,quote/hnx/DP3
42,43,hnx/IDV,Vinh Phuc Infrastructure Development JSC,1331959686600.0,32300.0,-0.6153846153846154,119582526199.0,quote/hnx/IDV
43,44,hnx/VTZ,Viet Thanh Plastic Trading And Manufacturing JSC,1325181094200.0,17400.0,-0.5714285714285714,3542984597319.0,quote/hnx/VTZ
44,45,hnx/DTD,Thanh Dat Investment Development JSC,1316493176500.0,23500.0,-0.423728813559322,494573791771.0,quote/hnx/DTD
45,46,hnx/SZB,Sonadezi Long Binh Shareholding Company,1227000000000.0,41300.0,0.0,337450137237.0,quote/hnx/SZB
46,47,hnx/TFC,Trang Corporation,1183148578200.0,70000.0,0.8645533141210375,907800792806.0,quote/hnx/TFC
47,48,hnx/TMB,Vinacomin - Northern Coal Trading JSC,1089000000000.0,72600.0,2.2535211267605635,41718811185328.0,quote/hnx/TMB
48,49,hnx/LHC,Lam Dong Investment and Hydraulic Construction Joint-Stock Company,1072800000000.0,74700.0,-0.1336898395721925,1229096725714.0,quote/hnx/LHC
49,50,hnx/EVS,Everest Securities JSC,1071204017000.0,6400.0,-1.5384615384615383,218489929220.0,quote/hnx/EVS
50,51,hnx/PMC,Pharmedic Pharmaceutical Medicinal JSC,1050847719800.0,112600.0,-1.054481546572935,498184992763.0,quote/hnx/PMC
51,52,hnx/INN,Agriculture Printing and Packaging JSC,1041448000000.0,58200.0,-1.3559322033898304,1766550070641.0,quote/hnx/INN
52,53,hnx/VC7,BGI Group JSC,1008950838000.0,10300.0,-1.9047619047619049,293915224690.0,quote/hnx/VC7
53,54,hnx/TVC,Tri Viet Asset Management Corporation JSC,954279231000.0,9500.0,0.0,246634528425.0,quote/hnx/TVC
54,55,hnx/CSC,Cotana Group JSC,953929041000.0,25500.0,0.0,590361400052.0,quote/hnx/CSC
55,56,hnx/L14,Licogi 14 JSC,947380970500.0,30800.0,0.0,136026574491.0,quote/hnx/L14
56,57,hnx/BCC,Vicem Bimson Cement JSC,936394571200.0,7900.0,0.0,3487978470438.0,quote/hnx/BCC
57,58,hnx/IDJ,IDJ Vietnam Investment JSC,919498022900.0,5500.0,0.0,714649590137.0,quote/hnx/IDJ
58,59,hnx/SGC,Sa Giang Import Export Corporation,894162258000.0,126800.0,-0.8600469116497262,707533084247.0,quote/hnx/SGC
59,60,hnx/PVC,Petrovietnam Chemical and Services Corporation,885019646700.0,11100.0,-0.8928571428571428,2963175877629.0,quote/hnx/PVC
60,61,hnx/SHN,Hanoi Investment General Corporation,803564311400.0,6200.0,0.0,3821515529003.0,quote/hnx/SHN
61,62,hnx/S99,SCI JSC,783161214900.0,8300.0,-1.1904761904761905,1395368266936.0,quote/hnx/S99
62,63,hnx/BKC,Bac Kan Mineral Joint Stock Corporation,764126092800.0,69000.0,7.476635514018691,567481233266.0,quote/hnx/BKC
63,64,hnx/IVS,Guotai Junan Securities (Vietnam) Corp.,742045000000.0,10700.0,0.0,72530647065.0,quote/hnx/IVS
64,65,hnx/PVB,PetroVietnam Coating JSC,734399932000.0,34000.0,-2.857142857142857,265172268736.0,quote/hnx/PVB
65,66,hnx/HJS,Nam Mu Hydropower JSC,716096590000.0,34100.0,10.0,149000069681.0,quote/hnx/HJS
66,67,hnx/CAP,Yen Bai Agro-Forestry Products & Foodstuff Corporation,706999379500.0,46400.0,0.0,550167818971.0,quote/hnx/CAP
67,68,hnx/NDN,Danang Housing Investment Development JSC,695081979200.0,9600.0,1.0526315789473684,55616946202.0,quote/hnx/NDN
68,69,hnx/PSD,Petroleum General Distribution Services JSC,694493779600.0,13000.0,-0.7633587786259541,5727409398445.0,quote/hnx/PSD
69,70,hnx/DXP,Doan Xa Port JSC,670993489600.0,11200.0,-0.8849557522123894,681740913400.0,quote/hnx/DXP
70,71,hnx/PIC,PC3 - Investment JSC,663463830900.0,20400.0,-5.116279069767442,116730807384.0,quote/hnx/PIC
71,72,hnx/BTS,Vicem But Son Cement JSC,654867247400.0,5300.0,0.0,2609613580989.0,quote/hnx/BTS
72,73,hnx/SJE,Song Da No. 11 JSC,635637099300.0,26300.0,0.381679389312977,2359678868681.0,quote/hnx/SJE
73,74,hnx/PCT,Global Pacific Shipping JSC,635450761100.0,12700.0,0.0,378770399678.0,quote/hnx/PCT
74,75,hnx/SAF,Safoco Foodstuff JSC,624013362000.0,52000.0,0.0,723778164286.0,quote/hnx/SAF
75,76,hnx/API,Asia-Pacific Investment JSC,605404627200.0,7300.0,-1.351351351351351,209580465103.0,quote/hnx/API
76,77,hnx/NTH,Nuoc Trong Hydro - Power JSC,596273325600.0,54200.000002,0.0,107631651286.0,quote/hnx/NTH
77,78,hnx/VC2,Vina2 Invest and Construction JSC,577663044000.0,8400.0,-1.1764705882352942,1233029252986.0,quote/hnx/VC2
78,79,hnx/VNT,The Van Cargoes and Foreign Trade Logistics JSC,574221346500.0,34500.0,2.6785714285714284,1424557233369.0,quote/hnx/VNT
79,80,hnx/DL1,Alpha Seven Group JSC,573674907600.0,1.745,0.87,547959392194.99994,quote/hnx/DL1
80,81,hnx/TVD,Vinacomin - Vang Danh Coal JSC,548546940800.0,12600.0,1.6129032258064515,6497780720614.0,quote/hnx/TVD
81,82,hnx/PHN,Hanoi Battery JSC,529535503000.0,73000.0,0.0,447855702110.0,quote/hnx/PHN
82,83,hnx/MST,MST Investment JSC,524429676899.99994,6900.0,0.0,1273965816144.0,quote/hnx/MST
83,84,hnx/APS,Asia Pacific Securities JSC,522900000000.0,6300.0,0.0,237535804377.0,quote/hnx/APS
84,85,hnx/HLD,HUDLAND Real Estate Investment and Development JSC,518239360400.0,16400.0,0.0,28958565964.0,quote/hnx/HLD
85,86,hnx/DNC,Haiphong Electricity Water Machine Assembly JSC,513777920000.0,65500.0,-0.7575757575757576,937408787887.0,quote/hnx/DNC
86,87,hnx/VNC,Vinacontrol Group Corporation,511328377200.0,48500.0,5.434782608695652,820483069668.0,quote/hnx/VNC
87,88,hnx/NRC,Danh Khoi Group JSC,502675510200.0,5900.0,1.7241379310344829,5149234224.0,quote/hnx/NRC
88,89,hnx/VNF,Vinafreight JSC,497939316000.0,15800.0,1.282051282051282,1770162801727.0,quote/hnx/VNF
89,90,hnx/HVT,Viet Tri Chemical JSC,483474596000.0,44000.0,-0.4524886877828055,1451020006655.0,quote/hnx/HVT
90,91,hnx/PSI,Petrovietnam Securities Incorporated,472746270000.0,8400.0,0.0,247053506533.0,quote/hnx/PSI
91,92,hnx/AAV,AAV Group JSC,469116094800.0,6800.0,0.0,38485998242.0,quote/hnx/AAV
92,93,hnx/BTW,Ben Thanh Water Supply JSC,463320000000.0,49500.0,0.0,561464712365.0,quote/hnx/BTW
93,94,hnx/SJ1,Hung Hau Agricultural Corporation,460810789600.0,10600.0,0.0,1900091951654.0,quote/hnx/SJ1
94,95,hnx/SD9,Song Da 9 JSC,458735600000.0,13600.0,0.0,426909134428.0,quote/hnx/SD9
95,96,hnx/CTP,Hoa Binh Takara JSC,457191529200.0,37800.0,0.5319148936170213,37776526169.0,quote/hnx/CTP
96,97,hnx/NAG,Nagakawa Group JSC,451146524400.0,13200.0,0.0,2615442577866.0,quote/hnx/NAG
97,98,hnx/MBG,MBG Group JSC,432786744000.0,3500.0,0.0,311186580224.0,quote/hnx/MBG
98,99,hnx/EID,Hanoi Education Development and Investment JSC,423000000000.0,28500.0,0.0,1131861293497.0,quote/hnx/EID
99,100,hnx/NBW,Nha Be Water Supply JSC,422920000000.0,37900.0,1.0666666666666669,906053704717.0,quote/hnx/NBW
100,101,hnx/HTC,HocMon Trade JSC,402599829200.0,24400.0,0.0,1014753133557.0,quote/hnx/HTC
101,102,hnx/NBC,Vinacomin - Nui Beo Coal JSC,399590539200.0,10900.0,0.9259259259259258,2812769703303.0,quote/hnx/NBC
102,103,hnx/NFC,Ninh Binh Phosphate Fertilizer JSC,393281500000.0,24600.0,2.5,914381030925.0,quote/hnx/NFC
103,104,hnx/C69,1369 Construction JSC,389339823600.0,6300.0,-1.5625,1094406956824.0,quote/hnx/C69
104,105,hnx/TTL,Thang Long Joint Stock Corporation,389239410000.0,9300.0,0.0,1663955117694.0,quote/hnx/TTL
105,106,hnx/VTV,Vicem Energy and Environment JSC,383757847500.0,13000.0,0.0,1360524438250.0,quote/hnx/VTV
106,107,hnx/GDW,Gia Dinh Water Supply JSC,357200000000.0,34000.0,-0.5847953216374269,672328330017.0,quote/hnx/GDW
107,108,hnx/CTB,Hai Duong Pump Manufacturing JSC,352944000000.0,25800.0,9.787234042553193,684754473081.0,quote/hnx/CTB
108,109,hnx/VSA,Vietnam Ocean Shipping Agency Corporation,352412150000.0,24900.0,-3.488372093023256,1101209084537.0,quote/hnx/VSA
109,110,hnx/SDU,Song Da Urban Investment Construction and Development JSC,348000000000.0,19200.0,9.090909090909092,85667551991.0,quote/hnx/SDU
110,111,hnx/MAC,Marine Supply and Engineering Service JSC,346700160500.0,22000.0,7.317073170731707,124492177234.0,quote/hnx/MAC
111,112,hnx/DVM,Vietnam Medicinal Materials JSC,342240000000.0,8200.0,-1.2048192771084338,,quote/hnx/DVM
112,113,hnx/PCH,Picomat Plastic JSC,336379499600.0,13900.0,0.0,194942239067.0,quote/hnx/PCH
113,114,hnx/HLC,Vinacomin - HaLam Coal JSC,330397587000.0,13900.0,7.751937984496124,2998557338965.0,quote/hnx/HLC
114,115,hnx/POT,Post and Telecommunication Equipment JSC,330310102000.0,17000.0,0.0,1617938491726.0,quote/hnx/POT
115,116,hnx/BAX,Thong Nhat JSC,328000000000.0,40000.0,2.564102564102564,72989804812.0,quote/hnx/BAX
116,117,hnx/CCR,Cam Ranh Port JSC,320342382700.0,13100.0,-9.027777777777777,178096396187.0,quote/hnx/CCR
117,118,hnx/THT,Vinacomin - Ha Tu Coal JSC,292371718800.0,11900.0,-0.8333333333333334,4282245723378.0,quote/hnx/THT
118,119,hnx/PVG,Petro Vietnam LPG JSC,291989210600.0,7500.0,1.351351351351351,5196289656524.0,quote/hnx/PVG
119,120,hnx/HOM,Vicem Hoang Mai Cement JSC,287990924000.0,4000.0,0.0,1709812611405.0,quote/hnx/HOM
120,121,hnx/TV4,Power Engineering Consulting Joint Stock Company 4,284853499200.0,14500.0,-0.684931506849315,207053172796.0,quote/hnx/TV4
121,122,hnx/VIG,Viet Nam Financial Investment Securities Corporation,284339790000.0,6100.0,-1.6129032258064515,42375110616.0,quote/hnx/VIG
122,123,hnx/TSB,Tiasang Battery Joint stock company,276564680000.0,41300.0,-1.1961722488038278,182053893851.0,quote/hnx/TSB
123,124,hnx/CLH,La Hien Cement JSC,276000000000.0,23100.0,0.0,661186027676.0,quote/hnx/CLH
124,125,hnx/X20,X20 JSC,272550000000.0,16000.0,-0.6211180124223602,1301552526668.0,quote/hnx/X20
125,126,hnx/BNA,Bao Ngoc Investment Production Corporation,268744788400.00003,8900.0,0.0,1726061598246.0,quote/hnx/BNA
126,127,hnx/SED,Phuong Nam Education Investment and Development JSC,266100659999.99997,29000.0,0.6944444444444444,1331233537816.0,quote/hnx/SED
127,128,hnx/VHL,Viglacera Ha Long joint stock company,265000000000.0,9800.0,0.0,1148291688627.0,quote/hnx/VHL
128,129,hnx/DDG,Indochine Import Export Investment Industrial JSC,263471623800.0,3300.0,0.0,357793955736.0,quote/hnx/DDG
129,130,hnx/SCI,SCI E&C JSC,262226117400.0,8600.0,-1.1494252873563218,1007950534867.0,quote/hnx/SCI
130,131,hnx/PMS,Petroleum Mechanical Stock Company,258543614800.0,36000.0,-2.702702702702702,1385858111571.0,quote/hnx/PMS
131,132,hnx/WSS,Wall Street Securities JSC,256530000000.0,5100.0,0.0,23333089398.0,quote/hnx/WSS
132,133,hnx/CAN,Ha Long Canned Food Joint Stock Corporation,252000000000.0,50400.0,-10.0,681810329515.0,quote/hnx/CAN
133,134,hnx/SD5,Song Da 5 JSC,249598540800.0,9800.0,0.0,2337132929483.0,quote/hnx/SD5
134,135,hnx/VGP,The Vegetexco Port JSC,246516543000.0,31400.0,-0.31746031746031744,10581070482074.0,quote/hnx/VGP
135,136,hnx/VC6,Visicons Construction and Investment JSC,244663169300.0,28000.0,1.083032490974729,1647088311259.0,quote/hnx/VC6
136,137,hnx/CMS,CMH Vietnam Group JSC,241798750000.0,9400.0,1.0752688172043012,202066527362.0,quote/hnx/CMS
137,138,hnx/HBS,Hoa Binh Securities JSC,237599856000.0,7400.0,1.36986301369863,14226883569.0,quote/hnx/HBS
138,139,hnx/KTS,Kon Tum Sugar JSC,235248000000.0,46400.0,-1.694915254237288,381153422288.0,quote/hnx/KTS
139,140,hnx/VCC,Vinaconex 25 JSC,230400000000.0,9300.0,-4.123711340206185,1057004061947.0,quote/hnx/VCC
140,141,hnx/VMS,Vietnam Maritime Development JSC,228599949200.0,25400.0,9.956709956709958,213827803788.0,quote/hnx/VMS
141,142,hnx/VSM,Vietnam Maritime Development JSC,228599949200.0,21000.0,0.0,213827803788.0,quote/hnx/VSM
142,143,hnx/PPT,Petro Times JSC,216562500000.0,12600.0,0.0,,quote/hnx/PPT
143,144,hnx/GMX,My Xuan Brick Tile Pottery and Construction JSC,206043739800.0,18200.0,1.1111111111111112,164814261304.0,quote/hnx/GMX
144,145,hnx/PJC,Petrolimex Hanoi Transportation and Trading JSC,205152108000.0,28999.999999,-1.612903225642287,1188944768920.0,quote/hnx/PJC
145,146,hnx/NAP,Nghe Tinh Port JSC,204413400000.0,9500.0,1.0638297872340423,208040982497.0,quote/hnx/NAP
146,147,hnx/VMC,Vimeco Joint stock company,193392576800.0,7300.0,-1.351351351351351,1118087481331.0,quote/hnx/VMC
147,148,hnx/GIC,Green Development and Investment Service JSC,192708000000.0,17100.0,-1.7241379310344829,159342953965.0,quote/hnx/GIC
148,149,hnx/RCL,Cho Lon Real Estate JSC,191250253200.0,13500.0,1.5037593984962403,14946403677.0,quote/hnx/RCL
149,150,hnx/PCE,Central PetroVietnam Fertilizer And Chemicals JSC,191000000000.0,19100.0,0.0,3150352405159.0,quote/hnx/PCE
150,151,hnx/DST,Sao Thang Long Investment JSC,186870200000.0,6000.0,0.0,53034478392.0,quote/hnx/DST
151,152,hnx/CIA,Cam Ranh International Airport Services Joint-Stock Company,186612430000.0,10300.0,0.0,123106972488.0,quote/hnx/CIA
152,153,hnx/KHS,Kien Hung JSC,183782728800.0,15200.0,0.0,657528281152.0,quote/hnx/KHS
153,154,hnx/DTG,Tipharco Pharmaceutical JSC,182926626600.0,21900.0,-0.4545454545454546,,quote/hnx/DTG
154,155,hnx/PPS,Petrovietnam Power Services JSC,172500000000.0,11700.0,0.0,372622978479.0,quote/hnx/PPS
155,156,hnx/TDT,TDT Investment and Development JSC,172055044800.0,7200.0,0.0,563129638093.0,quote/hnx/TDT
156,157,hnx/LDP,Lamdong Pharmaceutical JSC,171492322500.0,13300.0,3.10077519379845,217957757303.0,quote/hnx/LDP
157,158,hnx/VBC,Vinh Plastic and Bags JSC,170999088000.0,22800.0,9.615384615384617,822003074146.0,quote/hnx/VBC
158,159,hnx/TA9,Thanh An 96 Installation And Construction JSC,170151081900.0,13700.0,0.0,3455603546641.0,quote/hnx/TA9
159,160,hnx/TOT,Transimex Transportation JSC,168504094200.0,18400.0,3.3707865168539324,255129524908.0,quote/hnx/TOT
160,161,hnx/PPP,Phong Phu Pharmaceutical JSC,168079828100.0,19300.0,-0.5154639175257731,137548454537.0,quote/hnx/PPP
161,162,hnx/TJC,Transportation and Trading Services JSC,165980000000.0,17900.0,0.0,3344928808.0,quote/hnx/TJC
162,163,hnx/SDG,SADICO Can Tho Joint Stock Corporation,158183953200.0,15600.0,0.0,1106615410196.0,quote/hnx/SDG
163,164,hnx/MAS,Danang Airports Services Joint-Stock Company,157904271000.0,37600.0,-0.79155672823219,177406724480.0,quote/hnx/MAS
164,165,hnx/TTT,Tay Ninh Tourist - Trading JSC,154930119000.0,31500.0,0.0,124434586569.0,quote/hnx/TTT
165,166,hnx/GKM,Khang Minh Group JSC,147740913900.0,4600.0,0.0,145405107521.0,quote/hnx/GKM
166,167,hnx/L40,40 Investment and Construction JSC,146880000000.0,41500.0,1.715686274509804,340967016165.0,quote/hnx/L40
167,168,hnx/HMH,Haiminh Corporation,146727375000.0,15000.0,2.0408163265306123,121272479557.0,quote/hnx/HMH
168,169,hnx/SDA,SIMCO Song Da JSC,144132945000.0,5500.0,-3.508771929824561,41330743041.0,quote/hnx/SDA
169,170,hnx/V12,Viet Nam Construction Joint Stock Company No 12,143122800000.0,12300.0,-9.558823529411764,460882195733.0,quote/hnx/V12
170,171,hnx/PSW,South West Petrovietnam Fertilizer and Chemicals JSC,137700000000.0,8200.0,0.0,2708460952124.0,quote/hnx/PSW
171,172,hnx/ICG,Song Hong Construction JSC,137061600000.0,7900.0,1.282051282051282,13209223017.0,quote/hnx/ICG
172,173,hnx/PV2,PV2 Investment JSC,136414560000.0,3700.0,2.7777777777777777,150000000000.0,quote/hnx/PV2
173,174,hnx/PSE,South-East PetroVietnam Fertilizer and Chemicals JSC,132500000000.0,10500.0,-1.8691588785046729,3145293534178.0,quote/hnx/PSE
174,175,hnx/NST,Ngan Son JSC,129943234800.0,11200.0,-2.608695652173913,869476126115.0,quote/hnx/NST
175,176,hnx/HDA,Dong A Paint JSC,129719844900.0,4800.0,0.0,255973767442.0,quote/hnx/HDA
176,177,hnx/TV3,Power Engineering Consulting Joint Stock Company 3,126579943700.0,13300.0,-2.2058823529411766,185085686110.0,quote/hnx/TV3
177,178,hnx/LIG,Licogi 13 JSC,125918163200.0,3200.0,0.0,3766238031498.0,quote/hnx/LIG
178,179,hnx/EBS,Educational Book JSC in Hanoi City,123655756400.0,12600.0,0.8,72619116292.0,quote/hnx/EBS
179,180,hnx/PGN,Plastic Additives JSC,123043167000.0,13900.0,-0.7142857142857143,221001048262.0,quote/hnx/PGN
180,181,hnx/SVN,Vexilla Viet Nam Group JSC,121800000000.0,5600.0,-5.084745762711865,85558856460.0,quote/hnx/SVN
181,182,hnx/CAG,An Giang Port Joint-Stock Company,118680000000.0,8700.0,0.0,38371820418.0,quote/hnx/CAG
182,183,hnx/NSH,Song Hong Aluminium JSC,117952590900.0,5200.0,0.0,1012994256509.0,quote/hnx/NSH
183,184,hnx/KDM,Le Gia Investment Group JSC,116993507400.0,15400.0,-0.6451612903225806,35660063272.0,quote/hnx/KDM
184,185,hnx/DHP,Hai Phong Electrical Mechanical JSC,114855620000.0,12100.0,-0.819672131147541,237782477047.0,quote/hnx/DHP
185,186,hnx/PMB,North PetroVietnam Fertilizer & Chemicals JSC,114000000000.0,9600.0,0.0,2153311868675.0,quote/hnx/PMB
186,187,hnx/TTH,Tien Thanh Service and Trading JSC,112124538000.0,3100.0,0.0,872556641994.0,quote/hnx/TTH
187,188,hnx/DIH,Development Investment Construction Hoi An JSC,109617207600.0,15900.0,2.5806451612903225,222112989462.0,quote/hnx/DIH
188,189,hnx/STC,Book and Educational Equipment JSC,106511964000.0,19000.0,0.0,490317152826.0,quote/hnx/STC
189,190,hnx/VHE,Vietnam Herbs and Foods JSC,106047987200.0,3200.0,0.0,436101869536.0,quote/hnx/VHE
190,191,hnx/SHE,Son Ha Development of Renewable Energy JSC,105823147200.0,9000.0,0.0,196407617521.0,quote/hnx/SHE
191,192,hnx/TMC,Thu Duc Trading and Import-Export JSC,105400000000.0,8500.0,-1.162790697674419,2489000782722.0,quote/hnx/TMC
192,193,hnx/UNI,Vien Lien JSC,104638134400.0,6700.0,-2.898550724637681,1067037037.0,quote/hnx/UNI
193,194,hnx/VC1,Construction Joint Stock Company No. 1,103200000000.0,9500.0,0.0,508484750647.0,quote/hnx/VC1
194,195,hnx/MCF,Mechanics Construction and Foodstuff JSC,93767190600.0,8600.0,-1.1494252873563218,480125601327.0,quote/hnx/MCF
195,196,hnx/KSQ,CNC Capital Viet Nam JSC,93000000000.0,3100.0,0.0,7450091674.0,quote/hnx/KSQ
196,197,hnx/HCC,Intimex - Hoa Cam Concrete JSC,90607803300.0,13900.0,0.0,300015394544.0,quote/hnx/HCC
197,198,hnx/PDB,DIN Capital Investment Group JSC,89990808100.0,10200.0,0.0,307927199240.0,quote/hnx/PDB
198,199,hnx/ADC,Art Design and Communication JSC,89105766400.0,21200.0,0.47393364928909953,411845847050.0,quote/hnx/ADC
199,200,hnx/ARM,General Aviation Import Export JSC,87738180600.0,28200.0,0.7142857142857143,329859793051.0,quote/hnx/ARM
200,201,hnx/DAD,Da Nang Education Development and Investment JSC,87592960000.0,18000.0,-4.25531914893617,157758089664.0,quote/hnx/DAD
201,202,hnx/SDN,Dong Nai Paint Corporation,86842069600.0,28600.0,-2.054794520547945,119647971540.0,quote/hnx/SDN
202,203,hnx/PPY,Petrovietnam Oil Phu Yen JSC,84095766000.0,9000.0,-2.1739130434782608,4459752853829.0,quote/hnx/PPY
203,204,hnx/V21,Vinaconex 21 JSC,81598565200.0,6800.0,0.0,119230524183.0,quote/hnx/V21
204,205,hnx/NHC,Nhi Hiep Brick-Tile JSC,79688400400.0,21900.0,-8.368200836820083,49629856371.0,quote/hnx/NHC
205,206,hnx/PGT,PGT Holdings JSC,78555308500.0,8300.0,2.4691358024691357,36222104894.0,quote/hnx/PGT
206,207,hnx/PSC,Petrolimex Saigon Transportation and Service JSC,78480000000.0,10900.0,0.0,718691821370.0,quote/hnx/PSC
207,208,hnx/CPC,Can Tho Pesticides JSC,78363840000.0,19600.0,-8.837209302325581,190029517976.0,quote/hnx/CPC
208,209,hnx/KST,Kasati JSC,77896260000.0,13600.0,-4.225352112676056,450910060199.0,quote/hnx/KST
209,210,hnx/VC9,VC9 - No 9 Construction Join Stock Company,75128400000.0,4400.0,-2.2222222222222223,233707109417.0,quote/hnx/VC9
210,211,hnx/D11,Real Estate 11 JSC,74849007600.0,10200.0,-0.9708737864077668,106293882447.0,quote/hnx/D11
211,212,hnx/HMR,Hoang Mai Stone JSC,74084260800.0,13200.0,-6.382978723404255,,quote/hnx/HMR
212,213,hnx/ALT,ALTA Company,72856204300.0,12700.0,0.0,414845942519.0,quote/hnx/ALT
213,214,hnx/ITQ,Thien Quang Group JSC,66793725600.00001,2900.0,0.0,,quote/hnx/ITQ
214,215,hnx/PBP,PetroVietnam Packaging JSC,61433804800.0,12800.0,-0.7751937984496124,370230234432.0,quote/hnx/PBP
215,216,hnx/DS3,Riverway Management Joint Stock No.3,59750488000.0,5500.0,-5.172413793103448,51242863961.0,quote/hnx/DS3
216,217,hnx/ATS,Atesco Industrial Cartering JSC,59150000000.0,17500.0,8.024691358024691,50615224450.0,quote/hnx/ATS
217,218,hnx/KSD,DNA Investment JSC,58800000000.0,4700.0,-6.0,46391514376.0,quote/hnx/KSD
218,219,hnx/PMP,Dam Phu My Packaging JSC,58380000000.0,13900.0,0.7246376811594203,610721474763.0,quote/hnx/PMP
219,220,hnx/TTC,Thanh Thanh JSC,57029068800.0,9200.0,0.0,172524796980.0,quote/hnx/TTC
220,221,hnx/PCG,Petro Viet Nam Gas City Investment and Development JSC,56610000000.0,2900.0,-3.3333333333333335,,quote/hnx/PCG
221,222,hnx/VTJ,Vi Na Ta Ba Trading & Investment JSC,52440000000.0,4300.0,-4.444444444444445,,quote/hnx/VTJ
222,223,hnx/NDX,Danang Housing Development JSC,50814052100.0,5300.0,1.9230769230769231,49150095529.0,quote/hnx/NDX
223,224,hnx/DTC,Viglacera Dong Trieu JSC,50000000000.0,5000.0,0.0,141521957080.0,quote/hnx/DTC
224,225,hnx/VLA,Van Lang Technology Development and Investment JSC,49949950000.0,12700.0,5.833333333333333,14762079517.0,quote/hnx/VLA
225,226,hnx/HKT,Ego Vietnam Investment JSC,48466729100.0,7300.0,-7.59493670886076,115188432401.0,quote/hnx/HKT
226,227,hnx/PTS,Hai Phong Petrolimex Transportation and Services JSC,47884800000.0,9000.0,-2.1739130434782608,381961444967.0,quote/hnx/PTS
227,228,hnx/VCM,BV Life JSC,46200000000.0,7900.0,6.756756756756757,58714086272.0,quote/hnx/VCM
228,229,hnx/VTC,VTC Telecommunications JSC,45744344300.0,9700.0,2.1052631578947367,236597152008.0,quote/hnx/VTC
229,230,hnx/MKV,Cai Lay Veterinary Pharmaceutical JSC,45500000000.0,9100.0,0.0,109981801372.0,quote/hnx/MKV
230,231,hnx/ONE,One Technologies Corporation,43415119000.0,5500.0,0.0,580826086172.0,quote/hnx/ONE
231,232,hnx/BXH,Haiphong Packing VICEM JSC,42168560000.0,14000.0,-1.4084507042253522,170165944457.0,quote/hnx/BXH
232,233,hnx/LBE,Long An School Book and Equipment JSC,41798620600.0,20900.0,0.4807692307692308,,quote/hnx/LBE
